root@lamp-ubuntu-s-1vcpu-1gb-tor1-01:~# tcpdump -c 5 -i eth0
tcpdump: verbose output suppressed, use -v or -vv for full protocol decode
listening on eth0, link-type EN10MB (Ethernet), capture size 262144 bytes
21:44:15.690603 IP 134.122.47.169.ssh > dhcp-108-168-18-232.cable.user.start.ca.60452: Flags [P.], seq 3861124492:3861124600, ack 1263467702, win 501, length 108
21:44:15.690723 IP 134.122.47.169.ssh > dhcp-108-168-18-232.cable.user.start.ca.60452: Flags [P.], seq 108:144, ack 1, win 501, length 36
21:44:15.690835 IP 134.122.47.169.ssh > dhcp-108-168-18-232.cable.user.start.ca.60452: Flags [P.], seq 144:252, ack 1, win 501, length 108
21:44:15.690917 IP 134.122.47.169.ssh > dhcp-108-168-18-232.cable.user.start.ca.60452: Flags [P.], seq 252:288, ack 1, win 501, length 36
21:44:15.691745 IP 134.122.47.169.47727 > dns.google.domain: 30308+ PTR? 232.18.168.108.in-addr.arpa. (45)
5 packets captured
23 packets received by filter
0 packets dropped by kernel
