21:49:32.615296 IP 134.122.47.169.22 > 108.168.18.232.60452: Flags [P.], seq 1847788:1847952, ack 1009, win 501, length 164
21:49:32.615371 IP 134.122.47.169.22 > 108.168.18.232.60452: Flags [P.], seq 1847952:1848116, ack 1009, win 501, length 164
21:49:32.615448 IP 134.122.47.169.22 > 108.168.18.232.60452: Flags [P.], seq 1848116:1848280, ack 1009, win 501, length 164
21:49:32.615520 IP 134.122.47.169.22 > 108.168.18.232.60452: Flags [P.], seq 1848280:1848444, ack 1009, win 501, length 164
21:49:32.615590 IP 134.122.47.169.22 > 108.168.18.232.60452: Flags [P.], seq 1848444:1848608, ack 1009, win 501, length 164
21:49:32.615661 IP 134.122.47.169.22 > 108.168.18.232.60452: Flags [P.], seq 1848608:1848772, ack 1009, win 501, length 164
21:49:32.615738 IP 134.122.47.169.22 > 108.168.18.232.60452: Flags [P.], seq 1848772:1848936, ack 1009, win 501, length 164
21:49:32.615810 IP 134.122.47.169.22 > 108.168.18.232.60452: Flags [P.], seq 1848936:1849100, ack 1009, win 501, length 164
21:49:32.615884 IP 134.122.47.169.22 > 108.168.18.232.60452: Flags [P.], seq 1849100:1849264, ack 1009, win 501, length 164
21:49:32.615955 IP 134.122.47.169.22 > 108.168.18.232.60452: Flags [P.], seq 1849264:1849428, ack 1009, win 501, length 164
21:49:32.616025 IP 134.122.47.169.22 > 108.168.18.232.60452: Flags [P.], seq 1849428:1849592, ack 1009, win 501, length 164
21:49:32.616099 IP 134.122.47.169.22 > 108.168.18.232.60452: Flags [P.], seq 1849592:1849756, ack 1009, win 501, length 164
21:49:32.616169 IP 134.122.47.169.22 > 108.168.18.232.60452: Flags [P.], seq 1849756:1849920, ack 1009, win 501, length 164
21:49:32.616244 IP 134.122.47.169.22 > 108.168.18.232.60452: Flags [P.], seq 1849920:1850084, ack 1009, win 501, length 164
21:49:32.616322 IP 134.122.47.169.22 > 108.168.18.232.60452: Flags [P.], seq 1850084:1850248, ack 1009, win 501, length 164
21:49:32.616398 IP 134.122.47.169.22 > 108.168.18.232.60452: Flags [P.], seq 1850248:1850412, ack 1009, win 501, length 164
21:49:32.616472 IP 134.122.47.169.22 > 108.168.18.232.60452: Flags [P.], seq 1850412:1850576, ack 1009, win 501, length 164
21:49:32.616543 IP 134.122.47.169.22 > 108.168.18.232.60452: Flags [P.], seq 1850576:1850740, ack 1009, win 501, length 164
21:49:32.616628 IP 134.122.47.169.22 > 108.168.18.232.60452: Flags [P.], seq 1850740:1850904, ack 1009, win 501, length 164
21:49:32.616699 IP 134.122.47.169.22 > 108.168.18.232.60452: Flags [P.], seq 1850904:1851068, ack 1009, win 501, length 164
21:49:32.616772 IP 134.122.47.169.22 > 108.168.18.232.60452: Flags [P.], seq 1851068:1851232, ack 1009, win 501, length 164
21:49:32.616846 IP 134.122.47.169.22 > 108.168.18.232.60452: Flags [P.], seq 1851232:1851396, ack 1009, win 501, length 164
21:49:32.616916 IP 134.122.47.169.22 > 108.168.18.232.60452: Flags [P.], seq 1851396:1851560, ack 1009, win 501, length 164
21:49:32.616985 IP 134.122.47.169.22 > 108.168.18.232.60452: Flags [P.], seq 1851560:1851724, ack 1009, win 501, length 164
21:49:32.617061 IP 134.122.47.169.22 > 108.168.18.232.60452: Flags [P.], seq 1851724:1851888, ack 1009, win 501, length 164
21:49:32.617130 IP 134.122.47.169.22 > 108.168.18.232.60452: Flags [P.], seq 1851888:1852052, ack 1009, win 501, length 164
21:49:32.617204 IP 134.122.47.169.22 > 108.168.18.232.60452: Flags [P.], seq 1852052:1852216, ack 1009, win 501, length 164
21:49:32.617276 IP 134.122.47.169.22 > 108.168.18.232.60452: Flags [P.], seq 1852216:1852380, ack 1009, win 501, length 164
21:49:32.617350 IP 134.122.47.169.22 > 108.168.18.232.60452: Flags [P.], seq 1852380:1852544, ack 1009, win 501, length 164
21:49:32.617416 IP 108.168.18.232.60452 > 134.122.47.169.22: Flags [.], ack 1825724, win 1024, length 0
21:49:32.617479 IP 134.122.47.169.22 > 108.168.18.232.60452: Flags [P.], seq 1852544:1852812, ack 1009, win 501, length 268
21:49:32.617554 IP 134.122.47.169.22 > 108.168.18.232.60452: Flags [P.], seq 1852812:1852976, ack 1009, win 501, length 164
21:49:32.617630 IP 134.122.47.169.22 > 108.168.18.232.60452: Flags [P.], seq 1852976:1853140, ack 1009, win 501, length 164
21:49:32.617700 IP 134.122.47.169.22 > 108.168.18.232.60452: Flags [P.], seq 1853140:1853304, ack 1009, win 501, length 164
21:49:32.617792 IP 134.122.47.169.22 > 108.168.18.232.60452: Flags [P.], seq 1853304:1853468, ack 1009, win 501, length 164
21:49:32.617864 IP 134.122.47.169.22 > 108.168.18.232.60452: Flags [P.], seq 1853468:1853632, ack 1009, win 501, length 164
21:49:32.617936 IP 134.122.47.169.22 > 108.168.18.232.60452: Flags [P.], seq 1853632:1853796, ack 1009, win 501, length 164
21:49:32.618006 IP 134.122.47.169.22 > 108.168.18.232.60452: Flags [P.], seq 1853796:1853960, ack 1009, win 501, length 164
21:49:32.618069 IP 108.168.18.232.60452 > 134.122.47.169.22: Flags [P.], seq 1009:1045, ack 1825724, win 1024, length 36
21:49:32.618079 IP 108.168.18.232.60452 > 134.122.47.169.22: Flags [.], ack 1828676, win 1021, length 0
21:49:32.618091 IP 108.168.18.232.60452 > 134.122.47.169.22: Flags [.], ack 1828840, win 1026, length 0
21:49:32.618175 IP 134.122.47.169.22 > 108.168.18.232.60452: Flags [P.], seq 1853960:1854452, ack 1045, win 501, length 492
^C
11794 packets captured
11795 packets received by filter
